65,54,"<p>Hola, </p><p>además de la progresión que ha indicado mi compañero Gorka, es muy importante que combines tu entrenamiento de andar/carrera con ejercicios de fuerza y coordinación. De esta manera conseguirás mejorar en menor tiempo y sin riesgo de lesión.</p><p><br/></p><p>Un saludo!</p>","2015-07-04 10:50:20","2015-07-04 10:50:20"
163,54,"<p>Hola amigo!! dependerá principalmente de tu edad e historia deportiva, no es lo mismo un joven de 20 años que lleva años haciendo deporte en general que un veterano de 45 que su vida ha sido sedentaria, por lo que habría que tener mas datos para poder darte unas pautas que te ayuden, y al hilo de lo que dicen mis compañeros la prudencia y la adaptación es siempre necesaria y como no trabajar la técnica de carrera, el core, la fuerza general... suerte!!</p><p> </p>","2015-07-30 16:08:09","2015-07-30 16:08:09"
348,54,"<p>pues calro q si, esta genial, no fuerces la maqunia, deja q se acostumbre, busca retos asimilables, y superalos dia a dia y cuando estes listo busca asesoramineto de un profesional q te ayudara a conseguir objetivos sin lesionarte y mas eficazmente </p>","2015-09-17 21:32:32","2015-09-17 21:32:32"
583,54,"<p>Por supuesto que si ¡¡. Cuando una persona no está acostumbrada a correr y es novata en ese aspecto, la idea es hacer caminatas cada vez más intensas e ir intercalando carreritas cortas entre medias, cada vez de más y más duración con el fin de que tu cuerpo se haga a ese trabajo y puedas aguantar una carrera continua.</p><p>Es de vital importancia ir entrenando la &#34;técnica de carrera&#34; una vez que nos decidamos a intercalar esas carreritas, nos darán la postura adecuada y los movimientos exactos para la realización de ella, y nos será más fácil correr y mejoraremos la calidad de carrera</p>","2015-10-15 02:13:05","2015-10-15 02:13:05"
60,55,"<p>Hola, es muy difícil responder a tu pregunta de una forma general. Habría que analizarte, hacerte unas pruebas y test para de forma objetiva saber cuál es tu verdadero estado de forma. Te recomiendo que acudas a un buen entrenador personal y a un centro especializado para que te haga una prueba de esfuerzo, y así saber cómo puedes empezar. Saludos.</p>","2015-07-02 15:54:04","2015-07-02 15:54:04"
83,55,"<p>Buenas! Lo primero, yo iría a un profesional de la salud para que valore tu estado de forma y que te diera vía libre para realizar ejercicio. Una vez el visto bueno médico, empezaría a caminar si eres una persona que no está acostumbrada a hacer deporte. Caminar, nadar, bicicleta, ir con amigos a hacer deporte, incluso apuntarte a un gimnasio y consultar con los profesionales de allí una plan de entrenamiento de iniciación al ejercicio. Y como todo en la vida, poco a poco irás mejorando y pudiendo hacer más actividad física, más intensa y por más tiempo! Espero haberte ayudado, para cualquier cosa me tienes disponible aquí! Un saludo!</p>","2015-07-07 06:32:53","2015-07-07 06:32:53"
86,55,"<p>Buenas tardes. </p><p>Presupongo que no tienes ninguna enfermedad ni anomalía para poder iniciarte en el mundo de la actividad física, y en el caso de que así sea, como bien dicen mis compañeros, acude primero a un médico y que te haga un chequeo.</p><p>Una vez dado este paso, lo ideal sería que te dejaras ayudar por un profesional de la actividad física para marcarte unas primeras pautas, una vez le informes de qué actividades te gustan o te motivan más, ya que el primer escalón siempre es encontrar la verdadera motivación, y a partir de ahí trabajar de forma variada pero constante.</p><p>Cualquier duda, aquí estamos. Un saludo y mucho ánimo ;)</p>","2015-07-07 15:46:01","2015-07-07 15:46:01"
161,55,"<p>Si no quieres o no puedes contratar los servicios de un profesional, empieza cambiando hábitos, usa las escaleras en vez del ascensor, camina en vez de usar el coche... etc... empieza a dejar poco a poco el sedentarismo. Luego empieza a dar paseos, cada vez más largos, hasta que aguantes unos 30 - 40 minutos seguidos, luego comienza con pequeñas carreras suaves alternando con paseos (5 min de paseo, 2 min de carrera suave, y así), siempre sin forzar la maquinaria ;) no tengas prisas. Más adelante puedes buscar algún deporte o actividad que te motive, que te resulte satisfactorio y no un sacrificio (es muy importante sino quieres abandonar antes de tiempo), pero del mismo modo, tómalo con calma, deja que tu cuerpo se adapte progresivamente al esfuerzo de nuevo y ve aumentando cuando te sientas preparado. Si quieres realizar ejercicios en casa, empieza usando tu propio peso, nada de cargas o pesas, e intenta trabajar el cuerpo completo, comienza con un par de días por semana y deja suficiente tiempo de descanso entre las sesiones, y sobre todo pon interés en aprender a hacer los ejercicios antes de hacerlos o busca alguien que te oriente adecuadamente, no te fíes de cualquiera.</p>","2015-07-29 16:51:31","2015-07-29 16:51:31"
174,55,"<p>Como bien dicen mis compañeros y como bien recomienda el Colegio Americano de Medicina Deportiva (ACSM)  todo el mundo aparentemente sano menor de 55 años puede iniciarse en un programa de ejercicios físicos de carácter ligero a moderado sin necesidad de una prueba médica o un permiso médico especial.   Esto se traduce en caminar, bicicleta, nadar y ejercicios con cargas ligeras. Ya si nos metimos en programas más intensos la cosa cambia al igual que si tenemos varios factores de riesgo de sufrir un infarto de miocardio como podría ser por ejemplo  hipercolesteronemia o hipertensión. <span style=\"color: rgb(85, 85, 85);float: none;background-color: rgb(255, 255, 255);\">No obstante, todo buen entrenador te ha debido de pasar un PAR - Q y realizarte una prueba de campo sencilla para descartar patologías y valorar tu estado de forma como por ejemplo hacer un Test Rockport. Una vez valorado tu estado de forma y habiendo descartado problemas de salud, yo haría de 2 a 4 días de ejercicio no consecutivo, comenzando con ejercicios de movilidad articular, seguido de ejercicio muy suave cardiovascular, unos ejercicios multiarticulares con cargas muy ligeras y terminando nuevamente con ejercicio cardiovascular ligero. Después de explicarte todas estas pautas generales, te hago un resumen sencillo del mensaje que te quiero transmitir al igual que mis compañeros: el mejor ejercicio físico que puedes hacer es seguir los consejos de un buen entrenador. </span></p>","2015-08-08 10:43:30","2015-08-08 10:43:30"
204,55,"<p>Muy buenas!</p><p><br/></p><p>Te recomiendo tanto si has estado mucho tiempo sin hacer deporte o no acudas al medico a que te haga un chequeo general que todo este en buen estado para posteriormente empezar a realizar actividad física, es recomendable hacerse una prueba de esfuerzo 1 vez al año.</p><p><br/></p><p><br/></p><p>A partir de aquí deberas hacer un trabajo de adaptación anatómica, no puedes empezar metiéndole mucha caña al cuerpo, lo recomendable es de 4 a 6 semanas hacer una progresión.</p><p>Ejemplo:  Si estamos hablando de correr:</p><p>Empezar con 15-20 min de correr/caminar, a un ritmo que te permita mantener una conversación, esto significara que no estamos forzando. (A poder ser evitar asfalto) </p><p>Progresivamente ir aumentando las cargas (minutos y ratos que iremos corriendo).</p><p>Saldría a correr máximo 3 días las 3-4 primeras semanas, (costara porque tendrás ganas de salir cada día e ir aumentando el ritmo y distancia, pero este error se a de intentar evitar si no queremos tener lesiones/dolores en las próximas semanas!!) </p><p>Dejar siempre 1 día de descanso como mínimo entre un entrenamiento u otro.</p><p><br/></p><p>Tu mismo veras que semana tras semana te encontraras mejor!</p><p><br/></p><p>Cuando finalices estas 4-6 semanas de ejercicio en la disciplina que desees practicar, ya podrás darle caña al cuerpo! </p><p>Espero que te sea útil este pequeño ejemplo de adaptación anatómica, cualquier duda me tienes aquí para preguntarme cualquier cosa!</p><p><br/></p><p>Saludos! </p><p><br/></p>","2015-08-16 17:40:37","2015-08-16 17:40:37"
347,55,"<p>empieza. ya. mi consejo... ya mañana al gim, </p><p>una vez estes alli y hayas dado el paso mas dificil q es empezar, busca asesoramiento profesional por q quermos durar mucho tiempo y los expertos saben lo q tiene q hacer para q no te hagas daño y dures mucho practicando deporte, </p>","2015-09-17 21:30:40","2015-09-17 21:30:40"
58,56,"<p>Hola, te recomiendo que combines ejercicio aeróbico con ejercicios de fuerza. No hay ejercicios específicos para quitarte la barriga. No se puede perder la grasa de una zona localizada por más que hagas abdominales. También tienes que cuidar la alimentación. Un saludo</p>","2015-07-02 15:48:06","2015-07-02 15:48:06"
77,56,"<p>Tal como dice Gorka la grasa no se puede perder de forma localizada, no hay remedios milagrosos para eso, así a grandes rasgos te diría que lleves una vida mas activa, y cuides tu alimentación. habría que ver que tipo de cuerpo tienes, pero a veces cambiando un poco los hábitos se dan grandes resultados.  a grosso modo Te recomendaría para empezar 3 días en semana trabajo cuerpo entero ejercicios de fuerza a modo de circuito +  20 min aerobico justo después. y los días intercalados puedes intercalar una sesión de HIIT o rodaje lento, todo según tu nivel de forma fisica</p>","2015-07-06 23:06:06","2015-07-06 23:06:06"
160,56,"<p>Haz una rutina de fuerza seguido de ejercicio cardiovascular, unos 20 minutos es suficiente. Pero lo más importante es la alimentación, recuerda ésto: los abdominales se hacen en la cocina ;) </p>","2015-07-29 16:40:52","2015-07-29 16:40:52"
192,56,"<p>Como dicen mis compañeros lo mejor es combinar el ejercicio de fuerza con el ejercicio cardiovascular. Pero el orden es importante, has de realizar primero ejercicios de fuerza a una alta intensidad para agotar las reservas de glucógeno y así poder &#34;tirar de grasas&#34; principalmente en el cardio. </p>","2015-08-13 16:39:42","2015-08-13 16:39:42"
241,56,"<p>¡Hola!</p><p>Para conseguir un vientre plano y bajar de peso lo primero que has de saber es que no se puede reducir grasa corporal únicamente de una zona específica. Lo ideal es combinar ejercicios aeróbicos con ejercicios de fuerza, llevar una dieta equilibrada y un descanso óptimo. </p><p>Con los ejercicios de fuerza conseguirás que tu masa muscular aumente y tu cuerpo necesite quemar más calorías incluso en reposo, de esta forma, conseguirás que tu metabolismo se acelere y ayude en el proceso de quemar lípidos.</p><p>Seguir una buena alimentación es fundamental para conseguir tu objetivo, igual que tener un descanso suficiente para que el cuerpo pueda realizar sus funciones y su trabajo al 100%. </p><p>Te aconsejo probar el entrenamiento interválico de alta intensidad (HIIT) para tus sesiones de entrenamiento aeróbico al menos una vez por semana. </p><p>Espero haberte ayudado. </p><p>¡Un saludo!</p>","2015-08-23 16:26:27","2015-08-23 16:26:27"
346,56,"<p>te recomiendo lo mejor de lo mejor ???? ojo si los haces vas a estar en forma, vas conseguir no solo e objetivo de vientre plano si no q ademas mejorara tu calidad de vida, te sentiras mejor y afrontaras el mundo de otra manera, con mas seguridad en ti mismo... ahi va.. preparado??</p><p>todos!!!!! haz todo!!!1 pero haz!!! ya ahora mismo calzate unas zapas y sal a correr, buscate un entrenador q te programe una rutina, trabaja fuerza resistencia todo eso pero sobre todo pasatelo bien, coje a un amigo y dile vamos al gim deja la play y a entrenar.</p><p>y si a todo esto le añades un plan alimenticia... bueno ya si que la hemos liado... vas tener un cuerpo sano equilibrado y en forma... </p>","2015-09-17 21:28:21","2015-09-17 21:28:21"
70,57,"<p>Hola.Los estudios que se han realizado en las últimas decadas demuestran que no hay pruebas cientificas de que el entrenamiento de fuerza produzca daños en las placas epifisiarias o impidan el crecimiento.Asi que puedes entrenar tranquilo.Eso si ,te recomiendo que te diseñe el  programa de entrenamiento un entrenador personal cualificado, y que te realice un seguimiento,de esta forma conseguiras tus objetivos de forma eficaz y segura.</p>","2015-07-05 17:55:47","2015-07-05 17:55:47"
81,57,"<p>Buenas! Entiendo tu preocupación por las pesas y la altura ya que es un mito que está muy inculcado en los gimnasios, pero no deja de ser eso, solo un mito. Está más que demostrado que no se para de crecer en vertical por entrenar con pesas!! Mi consejo es que sigas entrenando como más cómodo te veas, ya sea rutina weider (la de lunes pecho, martes hombros...) fullbody, tirón-empuje, o cualquiera que te quieras inventar! Por último recalcarte que no vas a dejar de crecer por entrenar con pesas! Espero haberte ayudado, para cualquier otra consulta no dudes en preguntarme! Un saludo! </p>","2015-07-07 06:25:31","2015-07-07 06:25:31"
169,57,"<p>¡Buenas! coincido con mis compañeros en que el paradigma entrenamiento/crecimiento es un mito urbano: en toda la literatura científica no hay indicios sólidos para afirmar que el entrenamiento de fuerza hipertrofia tenga una efecto adverso sobre el crecimiento. Es más, atendiendo a los estímulos neuroendocrinos que el entrenamiento de la fuerza proporciona a nuestro metabolismo, aumenta la secreción de la hormona que regula todo nuestro crecimiento, la GH (growth hormone o hormona de crecimiento). En cuanto al sistema de entrenamiento: no hay un sistemas de entrenamiento que garanticen resultados, sino personas que responden al estímulo de entrenamiento que estos programas provocan, bajo mi prisma empírico la clave reside en jugar con este estímulo de entrenamiento y ir cambiandolo para así generar respuestas diferentes al entrenamiento, por ello cambia el entrenamiento en  cada microciclo (4 semanas), la idea es cambiar el estímulo cada X tiempo. </p><p>¡Un saludo!</p>","2015-08-02 17:04:28","2015-08-02 17:04:28"
72,58,"<p>Hola,</p><p>Lo primero que tienes que saber es cuantos quilos quieres adelgazarte. Una vez tengas claro tu objetivo tienes que fracturarlo en pequeñas metas mensuales para poder conseguirlas y seguir luchando por tu objetivo general. Una vez puesto un poco de orden, tienes que combinar la alimentación como bien dices y el ejercicio. Yo te recomiendo que combines ejercicios de alta intensidad como pueden ser burpees, jumping jacks, lunges con peso, con otro tipo de ejercicios de baja intensidad como puede ser correr a un ritmo lento durante 30 minutos. Esta combinación según los estudios más actuales son los más indicados para perder peso y tonificar a la vez. </p><p>Cuanto la dieta, tienes que comer proteína con pocos hidratos. Ten cuidado cuando comes la fruta que por la noche no va bien para adelgazar, en cambio, es muy buena por la mañana.</p>","2015-07-06 13:39:13","2015-07-06 13:39:13"
76,58,"<p>Todo depende, si tienes sobrepeso no te recomiendo alto impacto, si eres principiante, yo te recomiendo, primero perder algo de peso, con entrenamientos en circuito donde trabajes el cuerpo entero.  las claves que te doy.</p><p>1. Aumenta la masa muscular, usa ejercicio multiarticulares donde involucres gran parte de la musculatura: burpees, zancadas, sentadillas.</p><p>2. Realiza cardio justo después de tu entrenamiento, de 20 a 30 minutos, nadar, andar, o incluso correr si tu cuerpo te lo permite.</p><p>2. Poco descanso entre ejercicio para aumentar la deuda de oxigeno post ejercicio.</p><p>3. Dieta no tienes que seguir una dieta estricta, controla las porciones, de 5 a 6 comidas al día. Hidratos en sus formas integrales , y una pieza de proteína y verdura en cada comida, aumenta la ingesta de grasas saludables y recorta los hidratos. te dará mas sensación de saciedad. Limita los azucares simples, grasas saturadas,.</p>","2015-07-06 22:58:53","2015-07-06 22:58:53"
153,58,"<p>Bueno, con tan pocos datos sobre ti es difícil darte algún consejo más allá de las recomendaciones generales. Para añadir a lo que te ha dicho Jose Aparicio, respecto a tu nutrición, reparte las comidas diarias en 5 o 6 comidas, 3 principales y 2 o 3 snaks o meriendas. Evita siempre harinas y sus refinados, productos azucarados (mira las etiquetas de los productos, te sorprenderás cuántos productos tienen azúcar y la variación de azúcar entre el mismo producto de distintas marcas), el alcohol y las grasas saturadas. Es importante que descanses bien (8 horas al día) y que bebas mucha agua.<br/>No tomes fruta ni postres en las comidas principales, deja las frutas para los snacks, lo mismo con los yogurts, etc... en las comidas toma sólo comida.</p><p>Un saludo</p>","2015-07-29 15:31:51","2015-07-29 15:31:51"
181,58,"<p>Buenas, para aportar algo mas sobre lo que te han comentado los compañeros, querría recomendarte que si tienes poca experiencia en entrenamiento, lo mas aconsejable seria que hicieses ejercicios de fuerza en formato de circuito, es decir hacer 3-4 ejercicios trabajando todos los grupos musculares y al finalizar 2-3 vueltas al circuito realizar unos 5-10 minutos de trabajo cardiovascular moderado (110-130 pulsaciones)</p><p>De esta manera al consumir los depósitos de glucógeno con el trabajo de fuerza, empiezas a movilizar las grasas necesitando menos tiempo de entreno.</p><p>A medida que vayas mejorando tu condición física seria recomendable que te acercaras a trabajar tipo hiit en alta intensidad pero paso a paso...</p><p><font face=\"inherit\"><span>Respecto a la dieta como recomendación genérica </span></font>deberías<font face=\"inherit\"><span> de realizar las 5 comidas del día (desayuno,almuerzo,comida ,merienda y cena) comiendo mas </span></font>proteínas<font face=\"inherit\"><span> que hidratos, los hidratos yo los </span></font>comería<font face=\"inherit\"><span> por la mañana en el desayuno y almuerzo. De todas maneras respecto a la dieta </span></font>deberías<font face=\"inherit\"><span> de consultar a los especialistas que para eso tienen mas </span></font>conocimientos<font face=\"inherit\"><span> que nosotros.</span></font><br/></p><p><font face=\"inherit\"><span>Saludos,</span></font></p><p><span>Miguel,</span><br/></p>","2015-08-09 18:31:20","2015-08-09 18:31:20"
75,59,"<p>Hola! por lo que veo has bajado 20 kg,pero me faltan mas datos para darte mejor diagnostico, no se cuanto pesabas antes ni que peso rondas ahora ni de que forma lo perdistes. si es posible tonificar el abdomen en casa, prueba las planks o planchas con sus variantes, a medida que vayas cogiendo mas fuerza puedes ir incrementando la dificultad. pero lo mas probable es que necesites ganar masa muscular y que tengas que perder aun mas la grasa del abdomen que te falta. en este caso lo ideal seria que realizaras trabajos de fuerza a modo de circuito 2 o 3 veces semanales, y ejercicios cardiovasculares en días alternos. en cuanto al tiempo depende de muchos factores, puedes tener un abdomen perfectamente tonificado pero verse flácido por la grasa de alrededor. </p>","2015-07-06 22:47:46","2015-07-06 22:47:46"
80,59,"<p>Buenas! En cuanto a tu consulta, no se puede saber tu composición corporal solo con los datos que das pero entiendo que lo que quieres es perder la tripita que queda después de adelgazar muchos kilos. Como respuesta te diría que no te centres en el trabajo abdominal para quemar la grasa del abdomen (pues esto no es posible) ni para tonificar solo esta parte, sino que realices un trabajo de todo el cuerpo de fuerza (en casa se puede hacer perfectamente y más si dices que tienes material para hacerlo) mínimo 3 veces en semana, y que otros 2-3 días realices un trabajo más cardiovascular, que sea divertido y te gusta (jugar al fútbol, al baloncesto, salir en bici, nadar, salir a correr etc.) y sobre todo ser muy constante en la dieta, acude aun buen profesional de la nutrición si quieres ajustar más tu composición corporal! Espero haberte ayudado, y si quieres cualquier otra consulta aquí estoy para intentar resolverla! Un saludo!</p>","2015-07-07 06:20:40","2015-07-07 06:20:40"
98,59,"<p>Hola, es normal que despues de haber perdido 20kg tengas la tripa flácida, como bien dicen mis compañeros no debes centrarte en trabajar solo la cintura abdominal, sino centrarte en un trabajo de fuerza/tonificación ya que está demostrado que el trabajo con pesas ayuda a reducir la grasa de nuestro cuerpo, también está demostrado que no se puede reducir la grasa localizada sino que se hace a través de un conjunto.</p><p>Para poder ayudarte mejor tendrias que facilitar más datos. ya que cada persona es distinta y no se puede recetar un ejercicio para todo el mundo.</p><p>Los problemas fisicos ya sea dolor en alguna parte, una escoliosis, condición fisica y un largo etcétera, hace que cualquier plan que encuentres en internet te pueda ir mal. <br/></p><p>Si quieres tener un plan de entrenamiento personalizado o una dieta ajustada a tu cuerpo y vida, acude a un profesional.</p><p>Aún asi, en cuanto a tu pregunta aquí te mando un enlace con una rutina de ejercicios abdominales en el que podrás tonificarlo, te viene bien detallado y por niveles para que vayas en progresión: https://www.youtube.com/watch?v=LCjxU7JKsmE</p><p>Cualquier otra duda no dudes en decirlo, un saludo.<br/></p>","2015-07-10 21:16:12","2015-07-10 21:16:12"
147,59,"<p>Una vez más como dicen mis compañeros no solo puedes centrarte en una parte concreta del cuerpo. Yo te recomiendo trabajar en circuitos cortos, que dure cada uno 20minutos en diferentes dias y trabajaría con ejercicios cardiovasculares y tonificación donde se empleen varios músculos a la vez. Unas 10 estaciones por circuito y trabajando 45 segundos y 15 segundos de recuperación para prepararse a la siguiente estación. El objetivo es trabajar de forma anaeróbica para así acelerar el metabolismo y quemar mas rapidamente la grasa.</p><p>Sobre los ejercicios especificos de abdomen lo mejor es trabajarlo con planchas, primero de manera isométrica y poco a poco progresar los ejercicios añadiendo dificultad con movimientos dinámicos.</p><p><br/></p><p>Un saludo!</p>","2015-07-26 23:26:55","2015-07-26 23:26:55"
79,60,"<p>Buenas! En primer lugar te recomendaría que asistieses a un profesional de la dietética y la nutrición para cualquier tipo de &#34;dieta&#34;. En segundo lugar, te diría que cualquier tipo de plan alimenticio, tanto como entrenamiento, son totalmente personalizados e individualizados para cada individuo, por lo que no existe una &#34;dieta rica en hierro para un nadador&#34; sino que existe tantas dietas como nadadores haya, y todas perfectamente adaptadas. Mi consejo es que si eres amateur o semi profesional, comas variado llegando a cumplir tus necesidades calóricas en el día, que serán bastante altas si entrenas varias horas como lo suelen hacer los nadadores. Espero haberte podido ayudar. Cualquier cosa más me tienes a tu disposición. Un saludo! </p>","2015-07-07 06:13:50","2015-07-07 06:13:50"
73,61,"<p>Hola! Desde mi opinión la danza es una muy buena acticvidad fisica, muy completa, que además del trabajo cardiobascular, trabaja ritmo y cordinación, aumenta la autostima, y es divertido y estimulante, yo te animo a que si te gusta, vayas a por ello. Aparte, si eres delgada y tienes tripa, también puede ser por un tema postural,  así que si lo puedes combinar con ejercicios que te ayunden a tonifacar y colocar tu postura, como el pilates, mejor que mejor. <br/></p>","2015-07-06 21:56:10","2015-07-06 21:56:10"
82,61,"<p>Hola! eso de estar delgados y con tripa lo veo mucho. Pueden ser varios factores como lo comento mi compañera Ines:</p><p>1. Postural - puede ser que tengas que corregir tu postura incorporando pilates y concienciarte de tu postura. Un ejercicio muy bueno es intentar caminar en puntillas por unos 10 minutos todos los días en casa te ayudara a mejorar la posición de la pelvis y a estilizar tu postura.</p><p>2. La alimentación: Revisa tu alimentación. Asegúrate que estés en alimentándote bien. Ten cuidado con las grasas como los frutos secos. Los frutos secos son grasas muy buenas pero tampoco hay que abusar de ellas que al final son grasas. Intenta incorporal mucho verde a tu dieta, carnes magras e hidratos saludables como el boniato y los guisantes.</p><p>3. El estrés: Hay estudios que el estrés activa la hormona CORTISOL la cual suele activar el almacenamiento de grasas corporal en la zona umbilical.  Puedes añadir magnesio a tu dieta. Las puedes comprar en pastillas ya que suelen tener un sabor muy desagradable. Intenta tomar unos 2 gramos al despertar. El magnesio es un relajante muscular natural y eso te ayudara a controlar un poco la producción de cortisol, también las grasas omegas ayudan a desinflamar mucho, te recomiendo 3 a 4 gramos diarios aunque te digan que solo 1 al día es suficiente. Añade una relajación activa de unos 10 minutos para desconectar y descansar e incorporando el yoga en tu rutina te ayudará para la flexibilidad, control mental y controlar el cortisol. </p><p>4. Cardio: La danza es una actividad muy cardiovascular y allí estas muy bien! sigue con la danza e intenta añadir también algo de trabajo de resistencia a tu rutina para aumentar masa muscular la cual te ayudar a bajar la grasa corporal y también te beneficiara a la hora de tener mas fuerza en el baile. </p><p>Mucha suerte y la mitad del trabajo esta en la organización de tus comidas y rutinas el resto es voluntad. </p><p><br/></p>","2015-07-07 06:26:14","2015-07-07 06:26:14"
