155,32,"<p>El colágeno con magnesio te ayudará a aliviar esos tendones, pero tal y como te ha comentado Manu, los tejidos conectivos tardan más tiempo en fortalecerse que los propios músculos, así que no está de más dedicarles una pequeña atención especial. En la alimentación intenta mantener unos buenos niveles de vitamina C y E, así como de zinc. Haz ejercicios isométricos sin cargas en la posición extendida de los tendones, o con cargas enfatizando en la fase excéntrica (pero con bajo volúmen) con ejercicios que eviten el uso del momentum o inercia y un rango de movimiento corto. realiza buenos calentamientos y sesiones de estiramientos.<br/>Un saludo!!</p><p><br/></p>","2015-07-29 16:07:59","2015-07-29 16:07:59"
996,32,"<p>Buenas! poco que añadir a los compañeros. Genial el aporte de una pequeña carga excéntrica como trabajo complementario y genial un adecuado entrenamiento progresivo para no pasar la línea roja.</p><p>Ya sabes que estas cosas aunque parezca que no...se van acumulando y luego se pagan.</p><p>Tenemos que pensar que en el trabajo que realizamos hay muchos acortamiento y el tejido blando sufre. Un buen programa de estiramiento sistematizado y específico te va a venir bien para la descarga, y más importante aún, la prevención. Pregunta a escaladores con años de experiencia a ver como tienen las articulaciones de sus dedos :-)</p><p>Como te han comentado, tocar la alimentación sería un buen plus, no solo un protector articular sino modificar la actual alimentación en las formas que pueda afectar (como por ejemplo una alimentación ácida o el uso de aguas minerales debe cambiarse por una alimentación más alcalina y unas aguas osmotizadas).</p><p>Hablo desde la experiencia. Saludos.</p><p><br/></p>","2016-01-07 18:47:56","2016-01-07 18:47:56"
1146,32,"<p>A favor de lo que dicen mis compañeros, la escalada es un deporte que implica grandes cargas mecánicas, sobre todo en las articulaciones de los dedos y a todas sus estructuras adyacentes. Realmente estas estructuras no están preparadas ni diseñadas para soportar tales esfuerzos. Por tanto, la progresión de las cargas sobre estas necesita tiempo y constancia, ya que si avanzamos rápido y nos lesionamos retrocederemos mucho más.</p><p>También hay que tener cuidado en que tipos de agarre utilizar en los entrenamientos, ya que el agarre en arqueo puede ser bastante lesivo si se usa demasiado. Para evitar lesiones es mejor enfatizar el entrenamiento de dedos en el agarre en extensión y el semiarqueo, dejando el arqueo para realizarlo con menor asiduidad y para las vías en roca. </p><p>Lo ideal para adaptar las estructuras sin lesionarnos es realizar escaladas lo más variadas posibles para evitar el sobreuso. Alternar el tipo de presa, la distancia entre las mismas, el angulo de inclinación del plafón y los tipos de pasos (cruces, lanzamientos, estáticos, bicicletas, etc.). A la vez hay que utilizar diferentes métodos: Bloque corto y largo (1-6; 7-12 movimientos), Resistencia corta y larga (15-24; 25-100) y Continuidad (8-20 minutos). Sobre todo haciendo bastante énfasis en la Continuidad en las primeros niveles de rendimiento y utilizando bloques de intensidad submáxima. Desde mi punto de vista tampoco recomiendo el entrenamiento de tabla multipresa en las primeras etápas, ni mucho menos el campus board u otros entrenamientos dirigidos a la escalada. Ya que aparte de que crear una carga elevada en estas estructuras no mejoran la técnica y gestualidad de la escalada en sí.</p><p>A la vez, como bien dicen mis compañeros este entrenamiento acompañado de un trabajo de hipertrofia previa en los músculos primarios, cargas excéntricas, estiramientos, entrenamiento de los músculos antagonistas, una correcta alimentación y las recuperaciones adecuadas entre días de entrenamiento fortalecerá todas estas estructuras y las hará menos susceptibles a las lesiones.</p><p>En modo de resumen las claves se encuentran en la Constancia sobre un entrenamiento adecuado e individualizado y paciencia, ya que los resultados llegarán antes de lo que crees.</p><p><br/></p><p>Espero que te sea útil.</p><p>Saludos</p><p>Víctor Guillén</p><p><br/></p>","2016-01-29 10:57:24","2016-01-29 10:57:24"
34,33,"<p>Lo más importante sería diseñar una buena planificación del entrenamiento, después de un periodo tan largo de sedentarismo habría que empezar por una primera etapa de adaptación o acondicionamiento físico básico, esto quiere decir que tendrías que empezar a trabajar todas las capacidades físicas desde su vertiente más básica y general (fuerza básica global, resistencia aeróbica básica, flexibilidad) para poco a poco ir entrando en contenidos de entrenamiento más específicos (fuerza hipertrofia o máxima, resistencia anaeróbica, etc). Normalmente se suele comenzar con trabajos de fuerza muy sencillos en forma de circuitos en los que trabajes toda la musculatura a nivel general y en el apartado de resistencia aeróbica con entrenamientos extensivos pero de baja intensidad (entre 120-140 pulsaciones por ejemplo), aunque existen otros muchos ejemplos de entrenamiento totalmente válidos siempre cuando respeten ese principio de progresión de lo general a lo específico. Podrías comenzar este entrenamiento con una frecuencia de 2 veces por semana con días de descanso entre medias y poco a poco ir incrementando el número de sesiones por semana para pasado un período de 8-12 semanas de adaptación poder pasar a un entrenamiento más específico y exigente. Espero haberte ayudado. ¡Un saludo!</p>","2015-06-26 14:17:50","2015-06-26 14:17:50"
46,33,"<p>Hola amigo!! Enhorabuena por la decisión que has tomado!! Yo te recomendaría al menos ahora que empiezas que te pusieras en manos de un profesional. Antes de empezar y sabiendo que llevas muchos años sin hacer nada, es importante hacerte un test general de fuerza, elasticidad, resistencia, coordinación... y a partir de ver como te encuentras en este momento, te planificaría un buen y divertido entrenamiento orientado a los objetivos que fijemos. Suerte!!</p><p><br/></p>","2015-06-30 15:38:43","2015-06-30 15:38:43"
178,34,"<p>Buenos días</p><p>Mis compañeras tienen mucha razón en recalcar la exigencia técnica del Crossfit para poder practicarlo de forma sana y segura que es lo a lo que principalmente deberías atender. Verás que no es lo mismo por ejemplo la cargada que te enseñarán en Crossfit con la que muy posiblemente estarías haciendo en Body Pump. Los mismos Box de Crossfit suelente tener una buena planificación de los entrenamientos, teniendo sesiones exclusivamente para aprendizaje de elementos técnicos, otras por niveles de exigencia y otra para los que compiten y suelen aconsejarte bien de los días y horas que debes entrenar con ellos. Respecto a las agujetas, lo he comentado en una anterior pregunta. Normalmente no se las ha hecho mucho caso ya que al igual que vienen, se van y sin dejar aparentemente ningún riesgo. Esto ha cambiado un poco, si que se ven daños en tejidos musculares con la presencia de agujetas por lo que se recomienda hacer todo lo posible que no aparezcan como por ejemplo al terminar de entrenar hacer un poco de cardio ligero y estirar muy bien. </p><p>Espero haberte ayudado.</p><p>Un saludo </p>","2015-08-08 11:51:57","2015-08-08 11:51:57"
250,34,"<p>Buenos días!</p><p>Seguramente si empiezas a practicar Crossfit tengas que dar la bienvenida a las agujetas en tu vida, porque ya no te van a dejar en mucho tiempo y en parte se debe a que Crossfit como entrenamiento constantemente variado y gracias a la cantidad de posibilidad  de combinaciones posibles entre los ejercicios, todos los días se presentan  diferentes. Por otro lado, darte la bienvenida a esta comunidad crossfitera que va creciendo en España cada día más, cuando lo pruebes ya no lo vas a dejar. </p><p>Yo te sugeriría que olvidases cualquier tipo de entrenamiento o incluso rutina que hayas estado haciendo anteriormente, abre la mente y empieza a experimentar rangos de movimiento seguramente que no conocías. En el box que te hayas apuntado debería de haber unas clases de performance o cursos de iniciación para empezar con lo más básico, la técnica, conocimeto de ejercicios, nomenclaturas, material...etc</p><p>Te aconsejo que a partir de ahora no tengas prisa en conseguir objetivos o cargar pesos elevados, entrena y descansa y deja que tu cuerpo se adapte al nuevo sistema de entrenamiento.</p><p>Pero, sobre todo, disfruta entrenando!</p><p>Un saludo</p>","2015-08-27 07:39:16","2015-08-27 07:39:16"
336,34,"<p>Todo cambio implica un &#34;estrés&#34; &#34;trauma&#34;. En eso se basa el principio de confusión muscular. Si sabes escuchar a tu cuerpo sabrás hacerlo intuitivamente. Si no, que el profesional que tengas te sepa decir mientras te ve entrenado.</p>","2015-09-16 16:23:16","2015-09-16 16:23:16"
1137,34,"<p>Voy a ser breve, ni una cosa ni la otra. El crossfit no es la metodología adecuada, es imposible trabajar todas las capacidades físicas a la vez (que es lo que dicen ellos) sin que alguna salga perjudicada,¿ y cual será? Pues la fuerza claro (la más importante de todas). Si vienes de clases colectivas te aconsejo que busques algún centro donde hagan algún tipo de circuito de entrenamiento tipo CROSS-TRAINING ,más funcional y lo agradecerás, los resultados serán más que satisfactorios.</p>","2016-01-28 22:15:48","2016-01-28 22:15:48"
47,35,"<p>Hola amiga!! <br style=\"color: rgb(0, 0, 0);text-align: left;\"/>En tu caso que te practicaron una cesárea, lo recomendable es esperar de seis a ocho semanas antes de realizar ejercicio. Sigue con las caminatas a paso lento porque te ayudan a una mejor recuperación. A partir de este periodo consulta a tu médico.<br style=\"color: rgb(0, 0, 0);text-align: left;\"/>Cuando empieces hazlo de manera suave e incrementa tu actividad de forma gradual, evita ejercicios bruscos o con impacto. Supongo que lo que buscarás inicialmente es perder los kilos de mas que has ganado durante el embarazo y tonificar, por lo que debes realizar sobre todo trabajo de resistencia aeróbica con entrenamientos extensivos de baja intensidad para quemar grasa, combinado con ejercicios de fuerza para empezar a tonificar... Lo mejor es que te pongas en manos de un profesional con experiencia en postpartos. </p><p>Suerte y enhorabuena por tu bebé!!<br/></p><p><br/></p>","2015-06-30 16:01:30","2015-06-30 16:01:30"
292,35,"<p>Hola buenas, lo ideal para después de una cesárea es esperar la cuarentena del parto lo primero, y lo segundo una vez ya tu médico te de el alta lo primero que deberías de hacer es gimnasia abdominal hipopresiva para que empieces a recuperarte cuanto antes desde dentro, y después empezar a fortalecer abdominales para tener los &#34;cuadraditos&#34; que a todo el mundo les gusta.</p><p>Yo personalmente no me pondría a hacer abdominales.</p><p>Un saludo <br/></p>","2015-09-06 10:45:33","2015-09-06 10:45:33"
1090,35,"<p>Muy buenas!!</p><p>Me ha interesado mucho tu pregunta porque creo que es importante aclarar este tema, ya que por lo general se desconoce el riesgo que existe <span style=\"color: rgb(85, 85, 85);float: none;background-color: rgb(255, 255, 255);\">en la práctica de ciertos ejercicios (en concreto los clásicos<span class=\"Apple-converted-space\"> abdominales, entre otros) para una</span></span> mujer que acaba de ser mamá. </p><p>Como bien te decían antes los compañeros, es importante reposar durante al menos 6 semanas (en parto vaginal) y como mínimo 8 semanas tras una cesárea; para no inferir en la involución uterina. Hay que tener en cuenta a mayores ciertas individualidades (por ejemplo, atender a la cicatrización y recurrir a un fisioterapeuta si hiciera falta). Una vez superada esta fase, el ejercicio más recomendado (y yo te diría que el único hasta recuperar la funcionalidad de tu faja abdominal junto con la de tu suelo pélvico, ya que participan en sinergia), son los HIPOPRESIVOS. Notarás que recuperas tu figura, pero lo más importante, sentirás que mejoras tu calidad de vida. Pasados un par de meses podrás comenzar a hacer ejercicios de fuerza en máquinas y ejercicio aeróbico (baile, elíptica, bici...), aunque intenta esperar un poco más para las prácticas de alto impacto como correr o saltar.</p><p>Todo esto te ayudará a reducir cintura y mejorará tu aspecto; y tranquila por no hacer abdominales tradicionales porque estos no te van a dar los resultados que la gente espera de ellos, incluso puede perjudicarte aún pasados muchos meses de la cesárea. Yo nunca se los recomiendo a mujeres que han sido mamás, pero tampoco a hombres con problemas por ejemplo de hernias, ya que someten a mucha presión intraabdominal, provocando descenso de órganos y debilidad de tejidos.</p><p>Cualquier duda que te surja sobre este tema puedes ponerte en contacto conmigo. </p><p>¡Un saludo y enhorabuena por tu maternidad!!</p>","2016-01-16 21:58:02","2016-01-16 21:58:02"
150,36,"<p>Hola, </p><p>Antes de iniciar cualquier actividad deportiva es importante que le des tiempo al cuerpo para recuperarse de una operación compleja como es un parto asistido con cesárea. </p><p>Querer volver a hacer ejercicio demasiado pronto puede resultar en una herida abierta o infectada, antes de volver al gimnasio realiza paseos sencillos mientras tu medico te revisa y cuando el te de permiso para volver ya estarás lista, pero las 6 u 8 semanas después del parto no te las quita nadie. </p><p>Cuando finalmente estés lísta comienza con sesiones de abdominales suaves para después subir la intensidad a sesiones más complejas, recuerda siempre hacer caso a tu medico, todo lleva su proceso y ser mama es algo que requiere paciencia antes y después. </p><p><br/></p><p>Enhorabuena por la maternidad. </p>","2015-07-29 11:22:09","2015-07-29 11:22:09"
151,36,"<p>Hola,</p><p>Al igual que tras una lesión,después de cualquier operacion debemos respetar un periodo de reparacion de los tejidos(debe formarse el tejido cicatrizal) Dependiendo del tipo de lesión u operación este periodo puede durar de 3 a 8 semanas.A partir de  aquí puedes introducir algún ejercicio suave si no causa dolor y siempre consultando a tu médico antes.</p><p>Tras la reparacion comienza la fase de remodelacion del tejido que puede durar de 2 a 4 meses incluso un año si la operación o lesión ha sido muy grave.Durante este periodo puedes y debes realizar ejercicios funcionales. También ir incorporando cargas progresivas y ejercicios más específicos.Todo siempre, previa consulta con tu médico y te recomendaria que supervisado por un entrenador personal.</p><p>Espero que te haya servido de ayuda.</p><p>Un saludo y enhorabuena</p>","2015-07-29 13:54:22","2015-07-29 13:54:22"
173,36,"<p>Buenos días. </p><p>Lo primero es felicitarte por tu reciente maternidad. Respecto al punto de inicio para la realización de ejercicio físico después de un embarazo lo normal es que sea a partir de la sexta semana después del embarazo o también conocido como cuarentena. Al haber nacido por cesárea se recomienda un par de semanas más respecto a un parto normal para que no se abran los puntos y los tejidos se recuperen correctamente. Esto respecto a la realización de ejercicio general, si nos centramos en la realización de abdominales a priori no debería ser muy diferente siempre y cuando sigas unas pautas correctas. Yo no me metería en una clase colectiva tradicional de 30' ya que seguramente te haga más mal que bien debido a tu periodo de inactividad física  y a que requieres un trato especial enfocado a reforzar la parte más interna del core.. Ejercicios que fortalezcan el suelo pélvico serían los más correctos como por ejemplo los ejercicios de Kegel, pilates o gimnasia hipopresiva. Eso sí, son ejercicios que requieren supervisión de un profesional, sobretodo al principio para aprenderlos correctamente. </p><p>Espero haberte ayudado, un saludo </p>","2015-08-08 09:38:49","2015-08-08 09:38:49"
207,36,"<p>Buenas noches.</p><p>Antes de nada felicidades por tu bebe!!</p><p>Yo te recomiendo lo mismo que mi compañera Marga.. sobretodo con consentimiento de tu médico porque cada cesarea es un mundo (yo hace tres meses que me hicieron una también) cuando ya puedas empezar que sea con hipopresivos ya que te ayudara a recolocar todos los organos internos y ya más adelante sin prisa empieza poco a poco con abdominales... paciencia y veras que enseguida vuelve todo a la normalidad mientras disfrutas de un momento único.</p><p>Saludos!</p>","2015-08-16 21:41:53","2015-08-16 21:41:53"
332,36,"<p>me aventuro y te digo, minimo 3 mese para una cicarizacion adecuada. simpre bajo supervision medica, por encima de todo lo que te digamos esta tu medico.</p><p>mas, 1º te recomendaría empezar por hipopresivos estos no crean presión intra-abdominal y son mucho menos agresivos q los habituales, ademas corrigen la diastasis abdominal producida por llevar 9 meses un bebe dentro de la barriguita</p><p>2º trabajamos el suelo pelvico!!!! ha habido una lesion y hay q volver a tonificar toda la zona dañada, ejercicios de keguel.</p><p>3º con el tiempo combina los diferentes tipos de abdominales isometricos para mi los mejores mas q los q conllevan una flexión de tronco, asi sabras contrer suelo pevlvico a la vez que haces una pplancha etc etc..</p><p>y lo mas importante busca un especialista en este tipo de entrenamientos, q te asesore te enseñe y LO MAS IMPORTANTE QUE SIGAS REALIZANDO LO Q HAS APRENDIDO</p>","2015-09-14 23:48:05","2015-09-14 23:48:05"
40,37,"<p>Los abdominales hipopresivos son un muy buen complemento para fortalecer los músculos de la musculatura internos del abdomen (transverso, recto a terior, oblicuo interno) y como complemento a tu entrenamiento son una buena forma de ejercitar tu abdomen, pero no son la panacea. Me explico, no es la única novedosa y genial formula que convierte a todo lo demás en basura. Por otra parte los abdominales o cuadraditos aparecen cuando nuestra grasa corporal es baja, y esto  se logra gracias a un buen habito alimenticio sumado a realizar ejercicio de manera asidua </p>","2015-06-27 06:13:28","2015-06-27 06:13:28"
41,37,"<p>En cuanto a musculatura hay una errata: oblicuo interno y transverso, por otra parte el recto anterior, oblicuo, serratos... Como cara externa del abdomen. Un saludo y espero haber resuelto tus dudas </p>","2015-06-27 06:19:54","2015-06-27 06:19:54"
69,37,"<p>Estos abdominales son estupendos para reducir cintura y fortalecer sobre todo el transverso (músculo difícil de trabajar) y el suelo pélvico. Se crearon para resolver patologías pelvi perineales en embarazadas después del parto (prolapsos) y entre sus beneficios está el aumento de riego sanguíneo en la zona, reducción cintura y mejora del rendimiento deportivo. Si estas embarazada o eres hipertenso/a no los realices. <br/></p>","2015-07-05 09:26:21","2015-07-05 09:26:21"
177,37,"<p>Estoy de acuerdo con mis compañeros. Los ejercicios hipopresivos son una buena herramienta para fortalecer la musculatura abdominal, especialmente la más interna, que con los ejercicios abdominales tradicionales se dejaba muy de lado. No obstante, dudo mucho que haciendo únicamente abdominales tanto tradicionales como hipopresivos aparezcan los denominados &#34;cuadraditos&#34;. Para que aparezca depende más de dos factores: un bajo porcentaje de grasa en esa zona y que genéticamente estés predispuesto a tenerlos.  Más que moda, creo que fue una campaña muy agresiva de marketing y como tal, se ha llegado a decir auténticas barbaridades para promocionarlos y descalificar todo aquello que no fuese hipopresivo. Hoy en día se ha desmentido muchas de estas barbaridades como que  &#34;te estás lesionando por hacer abdominales tradicionales o que te vas a hacer pis encima por hacerlos&#34;. Ejemplo de ello lo tenemos en el Simposio de la Fuerza de 2012 donde se comentó los pros y las contras de la gimnasia hipopresiva en un marco científico muy crítico y profesional. </p>","2015-08-08 11:38:22","2015-08-08 11:38:22"
233,37,"<p>la  función principal de los músculos del core (recto, transverso, oblicuos) son la de mantener la postura, por lo que el tipo de fibra muscular que predominante en esos músculos es del tipo I (fibras posturales) y en mucho menor proporción las de tipo II. Con el trabajo hipopresivo no se trabaja el abdomen como si del biceps se tratará (tipo II), se trabaja teniendo en cuenta el tipo de fibra muscular predominante en esos músculos y tomándolos todos en conjuntos como una faja, lo que a lo largo de un entrenamiento adecuado conllevará una disminución del perímetro de la cintura, fortalecer toda la faja abdominal y mejorará la postura. En cuanto a los cuadradillos como bien dice Alexis “...se logra gracias a un buen habito alimenticio sumado a realizar ejercicio de manera asidua...&#34; <br/></p>","2015-08-21 16:21:25","2015-08-21 16:21:25"
251,37,"<p>Hola, ¿qué tal? Habiendo leído las respuestas que te handado mis compañeros, decirte desde el punto de vista técnico te han ofrecidouna clara imagen del origen y uso de los hipopresivos. En cuanto al modo en quehas hecho la pregunta, te podría aconsejar que no te fíes de las leyendas quecorren por los gimnasios o incluso revistas. Ningún ejercicio es el mejor o elpeor, todo depende de las necesidades y objetivos de cada persona. Sucede igualque los medicamentos, no debes consumirlos porque a tu vecina le fue genial,sino porque un médico cualificado te prescribe tu dosis del adecuado.</p><p>Si tu objetivo es ‘lucir cuadraditos’, cuyo responsable esel músculo recto del abdomen, que no se trabaja específicamente conhipopresivos; insisto en las recomendaciones de disminuir porcentaje graso. Otroconsejo sería incluir variedad en tus entrenamientos: el cuerpo se acostumbrarápidamente a los estímulos y si siempre empleas el tradicional ‘crunch’, novas a mejorar tanto y tan rápido como si entrenas al músculo para lo que estáhecho: ofrecer estabilidad. Utiliza isométricos como planchas y cadenas cinéticasunilaterales, como levantamientos de kettlebells (complementando ambos lados),etc. Hay infinitas posibilidades pero has de respaldar la creatividad conconocimiento, ayúdate siempre de un profesional.</p><p>¡Felíz ejercicio!</p>","2015-08-27 08:02:10","2015-08-27 08:02:10"
298,37,"<p>Complementando un poco la información expuesta, que es en mi opinión muy acertada, añadiría que esta técnica es un trabajo compensatorio. Como bien se ha dicho, se busca la contracción involuntaria de toda la faja abdominal para reeducar la función de la misma, pues no olvidemos que este es un grupo muscular predominantemente tónico y debe ser entrenado como tal. El entrenamiento más tradicional de abdominales y los malos hábitos de entrenamiento acaban por hacer perder la función tónica de toda la faja por su acción hiperpresiva y se convierte en un músculo que simula ser, por ejemplo, un bíceps, el cual no necesita estar activo todo el día (fásico). En muchos casos, es necesario la reeducación total, en otros, usarlo como técnica compensatoria. Por lo tanto, hay que darle el uso que merecen en base a cada caso particular. </p>","2015-09-07 18:06:34","2015-09-07 18:06:34"
345,37,"<p>estoy de acuerdo con mis compis, en lineas generales y evitando vender un producto, e decir por mi experiencia q son otra manera mas de hacer abd, son menos lesivos si, q te van a sair cuadraditos... eso depende de la dieta mas bien, q en su inicio antes de q pasase a ser un producto era un metodo y es un metodo para pre y post embarazo y entrenamneto de suelo pelvico... pues tambien... </p><p>consejo de profe??? haz de todo amigo aprende todo lo q puedas y no te encasilles en la variedad esta e exito</p>","2015-09-17 20:59:57","2015-09-17 20:59:57"
396,37,"<p>a ver en primer lugar no son ni mejores ni peores son un forma de hacer abdominales en los q no se ejerce una presión intrabadominal, </p><p>hace poco q salieron a la luz y muchos han querido hacer empresa de ello ,o cual es magnifico, recordemos q el método pilates es tambien un sitema de entrenamiento inventado y hecho empresa pòr muchos, </p><p>mi opinión sincera es, hay q aprender a hacer de todo y contra mas variado sea tu entreno mejor. si buscas fatiga o sobe carga como con los abd de siempre no te los recomiendo, es una manera de entrenar abd de una forma suave y poco agresiva, eso si también son m uy efectivos asiq yo que tu no dudaría en aprender este tipo de entrenamiento.</p>","2015-09-28 23:26:23","2015-09-28 23:26:23"
1132,37,"<p>Todos los ejercicios son bueno lo esenciAL para marcaar es el % de masa de grasa para que te marquen además de eso hay que complementar fortaleciendo laas lumbares k son importantes y si kieres conseguir abdominales maas k ejercicios y repeticiones buscaria un objetivo k sería hacer ejercicioss cada vez más complicados es decir de abdominal normal en el suelo a colgados en barra y llegando ha hacer laa bandera esa creó k es laa clave para conseguirlo maas k realizar repeticiones y repeticiones k lo acabas sobreentrenando y jodiendote la espaalda</p>","2016-01-28 19:00:15","2016-01-28 19:00:15"
