402,76,"<p>Totalmente de acuerdo con mis compañeros. Quizás de entrada, si deseas que el dolor desaparezca, debes reducir cuanto puedas tus entrenamientos de carrera, sustituyéndolos por entrenamientos combinados de bici/elíptica, por ejemplo. Cuanto más elimines los impactos que recibe la zona dañada mucho mejor para recuperar su funcionalidad. Para ello, puede ayudarte, efectivamente, la aplicación de baños de contraste (intercalar períodos de frío-calor cada 5´2-3 veces al día). Si el dolor desaparece y puedes volver a tus entrenamientos, siempre de forma progresiva y distribuyendo bien el volumen de km sin ninguna molestia perfecto!!</p><p>Si el dolor continúa, efectivamente sería recomendable visitar al podólogo para que examine si es necesario el uso de plantillas, analice tu pisada, etc. A este nivel es complicado saber con certeza el motivo concreto, pero puede deberse hasta por falta de técnica de carrera, demasiado kilometraje, terrenos y todo lo que han comentado mis compañeros ;)</p><p>En fin, siempre que existe dolor lo importante es acudir a un especialista del dolor (médico) y a partir de sus pautas ir observando va evolucionando la lesión.</p><p>Saludos y suerte!! =D</p>","2015-09-29 14:40:09","2015-09-29 14:40:09"
415,76,"<p>Buenos días, lo importante que debería saber es porqué se produce la periostitis para poder solucionarla. Entiendo que como ya le habrá comentado es la inflamación del periostio pero, ¿Por qué se inflama? Esta inflamación normalmente es debido a un golpe o bien a microimpactos de repetición, el matiz que le solucionará el problema es que los microimpactos seguro que los ha recibido durante años y el que ahora den una patología es debido a que el hueso no se encuentra estable, al no estar estable se genera un exceso de vibración y como el hueso no puede hacer su labor de sostén buscamos otras estructuras que nos pueda sujetar, y en este caso el periostio, de manera que cada vez que apoya la pierna o realiza un microimpacto la vibración se extiende por el periostio y duele.</p><p>Para solucionarlo, coloque un palo de madera ( por ejemplo de helado) pegado a la tibia para que este hueso se lleve la vibración y la desvíe del periostio. Y si prefiere solucionar el problema en vez de poner un parche, realice ejercicios de propiocepción de tobillo así como diríjase a un osteópata que coloque el hueso en su sitio y devuelva la estabilidad del tobillo rodilla y por tanto tibia, si fuera en este hueso donde se encuentra su problema. </p><p>Un saludo.</p>","2015-09-30 07:55:35","2015-09-30 07:55:35"
201,77,"<p>La fascitis plantar es una lesión de carácter muscular que afecta a la parte más superficial de los músculos de la planta del pie, inflamándose dicho tejido y provocando un dolor muy agudo en la zona afectada.  Muchas son las causas de esta lesión como pueden ser: un mal calzado, sobrecargas de entrenamiento  y posiciones  inadecuadas haciendo ejercicio o en el día a día. Como toda lesión, lo primero es buscar al culpable de dicha lesión a la par que se trata. Muchas veces con reposar y cambiar de zapatillas se soluciona, sin embargo, en otros casos es necesario aplicar técnicas de fisioterapia e incluso medicamentos. Espero haber podido ayudarte. Un saludo. </p>","2015-08-16 10:16:34","2015-08-16 10:16:34"
214,77,"<p>La fascitis plantar es una inflamacion de una banda de tejido conjuntivo que hay entre la planta (lo que veis del pie) y los musculos el pie). Es algo asi como la zona que permite que la estructura osea absorba el peso y lo devuelva en forma de movimiento.</p><p>Como todaslas estructuras de tejido conjuntivo, si no se mueve se deshidrata, por lo que aunque duela, es importante no dejar de moverlo. Evidentemente si duele al hacer una actividad, no haremos eso, o cambiaremos de superficie de impacto (por ejemplo correremos por hierba o en el agua), pero repito, la inmovilidad produce deshidratacion en los tejidos, con lo que retarda su recuperacion. <br/></p><p>Los masajes vienen bien; evidentemente la realizacion de una tecnica correcta de la actividad que sea es imprescindible, pero sobre todo hay 2 cosas que podeis hacer muy facilmente para mejorarlo. Una es rodar sobre una pelota de tenis con todo el peso sobre ello; proporciona una libercion miofascial en la zona que a veces es suficiente para resolverlo; es muy doloroso y cruje, pero mejora enseguida. La otra es estirar bien toda la cadena recta posterior incluyendo el pie. Va muy bien la posicion de cuclillas y desde ahi llevar el peso adelante hasta quedarnos sobre los dedos.  Espero que os sirva<br/></p>","2015-08-19 08:11:48","2015-08-19 08:11:48"
229,77,"<p>Después de haber sufrido yo misma una fascitis plantar, te recomiendo que te informes bien sobre el proceso de recuperación (el ejercicio sobre la pelota de tenis que  menciona Antonio es fantástico), y sobre todo es fundamental que investigues la causa de la fascitis, ya que puede estar provocada por muchos factores.</p><p>Conozco varios casos de personas que la han sufrido por sobreentrenamiento o por trabajo de running en superficies excesivamente duras, pero puede haber también causas relacionadas con la estructura de tu pie o con la pisada.</p><p>En mi caso, se me detectó un problema de pisada que venía provocado por una falta de fuerza en la musculatura del pie, así que además de corregir ese problema con unas plantillas tengo que dedicar tiempo a ejercitar esa musculatura con ejercicios específicos y con natación.</p><p>Mi consejo, por tanto, es que pongas toda tu energía en solucionar no solo la fascitis, sino la causa de la fascitis, para evitar que tengas de nuevo ese problema en el futuro.</p>","2015-08-21 12:15:53","2015-08-21 12:15:53"
237,77,"<p>Muy de acuerdo con Laura sobre lo de potenciar la musculatura que sostiene nuestra boveda plantar. Sabeis la principal causa de que hayamos debilitado tanto nuestros pies? el propio calzado. No voy a hacer una defensa a ultranza sobre correr descalzo o últimaas tenencias de calzado minimalista , etc, aunque personalmente me gustan mucho, pero sí os aconsejo que probeis a caminar descalzos todo lo que podais porque nos cambia totalmente la pisada y simpemente eso lo fortalece y repercute directamente en la fascitis si la teneis, oen evitarla. Ejercicios tan sencillos como andar de puntillas, de talones sobre los cantos de los pies......son sencillos y maravillosos (pero hacedlos descalzos!!!) y ya si podeis trotar un poquito descalzos......al principio es extraño pero...yo he oido ronronear a mis propios pies!!! jejeje<br/></p>","2015-08-22 20:49:38","2015-08-22 20:49:38"
1460,77,"<p>Lo que es una fascitis plantar lo puedes ver directamentebuscando en Wikipedia (como hace la mayoría de gente) yo evito este paso, yaque te lo han puesto previamente pero te diré las causas más probables</p><ul><li>Alteraciones mecánicas<ul><li>Esta es la más conocida por la mayoría ( la mayoríade entrenadores no contemplan otras opciones)</li></ul></li><li>Alteraciones vertebrales y viscerales<ul><li>Esta es otra opción bastante desconocida para lamayoría olvidando que las vísceras están suspendidas internamente en el cuerpo.Cuando una de estas entra en disfunción (mal funcionamiento) crea tensiones y posibles dolores ( en el caso de la fascitis tiene relación con el riñón</li></ul></li><li>Intoxicación de los tejidos<ul><li>Mala alimentación, y de rebote por un malfuncionamiento de las vísceras.</li></ul></li><li>Atrapamiento nervioso<ul><li>Compresión de una raíz nerviosa, irritación delnervio ( las causas de dicha inflamación son varias ( puede tener un componentetambién emocional)</li></ul></li><li>Pie cavo <ul><li>Desajuste mecánico, normalmente los pies son el reflejo de estructuras óseas más altas, como la pelvis y lumbares. Según estén colocadasestas, los pies deberán adaptarse.</li></ul></li></ul><p>Posibles soluciones:</p><ul><li>Estiramiento de músculos gemelos</li><li>Masaje y movilización de los tejidos (pelota ya lo comentaron antes)</li><li>Movilización del sistema nervioso (trabajo de cadenas musculares, muy efectivo) </li><li>Fitoterapia alimentación (riñón, aprende a comer mejor y vigila tu dieta)</li></ul>","2016-05-21 23:25:55","2016-05-21 23:25:55"
196,78,"<p>La suplementación no te hará coger grasa, tomes proteínas o subidor de peso, la dieta es lo que lo hará. Bajo mi punto de vista necesitas una buena dieta con al menos 5 comidas diarias, aumentando la ingesta de hidratos, ahí es donde te recomiendo meter el gainer. Simplemente calcula bien tu dosis diaria de proteínas ( 2,5 g por kg al día) e hidratos (unos 5-7 g por kg al día en fase de volumen). Suerte con las oposiciones!!!</p>","2015-08-14 16:34:58","2015-08-14 16:34:58"
202,78,"<p>¡Buenas! ¡Lo primero de todo desearte suerte con las oposiciones! Coincido con la respuesta de mi compañero José María, las cantidades de los macronutrientes son correctas y la distribución de las comidas también, pero ¡ojo! los gainer son un suplemento con doble filo, muchos de ellos presentan monosacáridos (la estructura más simple del HCO), el azúcar o sacarosa siendo el más corriente y un excedente de ellos si puede acumularse en el tejido adiposo. Te recomiendo el Pro complex gainer, presenta almidón como hidrato de carbono, de asimilación más lenta. A partir de aquí creo que tu mayor preocupación no debería de ser esa, sino la planificación y periodización de tu entrenamiento, desde mi punto de vista excesiva, dejas poco tiempo para la recuperación y para que se puedan producir las adaptaciones pertinentes tras tus sesiones. La estructura microcíclica que comentas (semanas) y las dobles sesiones casi suenan a microciclo de impacto (una carga muy muy alta propia de los atletas de élite) Si sigues así lo único que conseguirás es llegar al sobreentrenamiento. Planifica en función de tus objetivos y no busques la cantidad, sino la calidad en tus entrenamientos y que estos sean eficaces. Si tienes cualquier duda puedes ponerte en contacto conmigo.</p><p>¡Un saludo y suerte!</p>","2015-08-16 15:34:40","2015-08-16 15:34:40"
205,78,"<p>Muy buenas!</p><p>Primeramente si estas preparando unas pruebas físicas como son las de Policía Nacional, evitaría ganar volumen e intentaría ganar fuerza que es lo que te será útil a la hora de superar las diferentes pruebas.</p><p>Después la especificidad de los entrenamientos deberán estar de acorde a dichas pruebas, por lo tanto, nos comentas que corres 40-60' pero no solo es correr! Es una prueba de 2.000m y otra de agilidad, necesitas hacer entrenamientos de velocidad, ya sean series, farleks, ejercicios de agilidad volteando objetos, saltando, agachándote etc...</p><p><span><br/></span></p><p><font face=\"inherit\"><span>Si quieres ganar volumen espera a realizar las pruebas </span></font>físicas o perderás rendimiento.</p><p><font face=\"inherit\"><span>Espero haberte ayudando, cualquier cosa no dudes en preguntarme!</span></font></p><p><font face=\"inherit\"><span><br/></span></font></p><p><font face=\"inherit\"><span>Un saludo!!   </span></font><br/></p>","2015-08-16 18:01:43","2015-08-16 18:01:43"
212,78,"<span style=\"color: rgba(0, 0, 0, 0.701961);background-color: rgb(255, 255, 255);\">¡Que tal! Te deseo éxitos en tus oposiciones, espero que mi respuesta resuelva todas tus dudas. Te separare la información en 3 partes diferentes porque hay cosas que me llaman la atención de tu pregunta.</span><div style=\"color: rgba(0, 0, 0, 0.701961);background-color: rgb(255, 255, 255);\"><br/><div>1. Entrenamiento fuera del cuerpo de policía, te explicare que necesitas para desarrollar masa muscular, fuerza, potencia, entre otras y las diferencias de cada objetivo.</div><div><br/></div><div>2. Entrenamiento específico para las pruebas de las oposiciones.</div><div><br/></div><div>3. Último pero el más importante, la nutrición.</div><div><br/></div><div>1:</div><div><br/></div><div>Me dices que quieres ganar masa muscular y fuerza, que entrenas 1 grupo muscular por día a excepción de los bíceps y tríceps, y que corres de 40 mins a 1 hora. Primero, ganar masa y ganar fuerza son 2 cosas diferentes causadas por factores diferentes del entreno.</div></div><div style=\"color: rgba(0, 0, 0, 0.701961);background-color: rgb(255, 255, 255);\">Para ganar masa (hipertrofia sarcoplasmática) es necesario utilizar un peso medio que te permita realizar de 7 a 12 repeticiones por sets. Esto es alrededor del 75% de tu RM.</div><div style=\"color: rgba(0, 0, 0, 0.701961);background-color: rgb(255, 255, 255);\">En cambio, para ganar fuerza (hipertrofia miofibrilar) se necesita un peso alto que solo te permita realizar de 1 a 6 repeticiones, del 85% al 100% ya que las fibras musculares que se activan al ejercer resistencia contra el peso son diferentes.</div><div style=\"color: rgba(0, 0, 0, 0.701961);background-color: rgb(255, 255, 255);\"><br/></div><div style=\"color: rgba(0, 0, 0, 0.701961);background-color: rgb(255, 255, 255);\">Fuera de lo que son las oposiciones, mi programa de entreno estaría formado por microciclos dentro de los cuales trabajarías una variedad de ejercicios enfocados a la fuerza y a la masa, por supuesto, también ejercicios cardiovasculares que es muy importante por sus beneficios a nivel celular y procesos metabólicos del cuerpo. En vez de trabajar 1 solo grupo muscular por día, una buena recomendación es no aislar músculos, mejor sale combinar varios en un día sea Agonista y Antagonista, Tren superior y Tren inferior, Tamaños de grupos musculares, entre otras. No me extenderé tanto así que continuare con el segundo punto.</div><div style=\"color: rgba(0, 0, 0, 0.701961);background-color: rgb(255, 255, 255);\"><br/></div><div style=\"color: rgba(0, 0, 0, 0.701961);background-color: rgb(255, 255, 255);\">2:</div><div style=\"color: rgba(0, 0, 0, 0.701961);background-color: rgb(255, 255, 255);\"><br/></div><div style=\"color: rgba(0, 0, 0, 0.701961);background-color: rgb(255, 255, 255);\">El entrenamiento para realizar las pruebas a las oposiciones, si es que buscas la excelencia, son los entrenamientos específicos. Dedicarte a ganar masa cuando vas a presentar pruebas de agilidad, rendimiento aeróbico, rendimiento anaeróbico y fuerza, hará que tu desempeño baje de categoría. Para lograr tu objetivo combina ejercicios de alta intensidad, súmale sprints a tus rutinas, desarrolla tu fuerza como te explique en el párrafo de arriba, para la agilidad puedes hacer circuitos con conos, pelotas medicinales, escalera de agilidad, ejercicios multi articulados como es el burpee, thrusters, etc. Es importante que tal rutina este debidamente periodizada, o por lo contrario no dejarás que cada músculo descanse y sobrecompense el microtrauma causado por tal trabajo.</div><div style=\"color: rgba(0, 0, 0, 0.701961);background-color: rgb(255, 255, 255);\"><br/></div><div style=\"color: rgba(0, 0, 0, 0.701961);background-color: rgb(255, 255, 255);\">3: </div><div style=\"color: rgba(0, 0, 0, 0.701961);background-color: rgb(255, 255, 255);\"><br/></div><div style=\"color: rgba(0, 0, 0, 0.701961);background-color: rgb(255, 255, 255);\">La dieta como sabes forma el 70% de tu progreso. La nutrición varía en cuanto al entreno, para eliminar grasa, es necesario una dieta con un déficit calórico, y para aumentar masa es necesario un exceso calórico.</div><div style=\"color: rgba(0, 0, 0, 0.701961);background-color: rgb(255, 255, 255);\">En cuanto a tu pregunta, si entrenas específicamente para las oposiciones, la dieta Zig-zag te vendría excelente. Ejm: de Lunes a Viernes cuando entrenes fuerte, consumes mas calorías de las quemas (exceso calórico), y Sábado y Domingo cuando solo tengas que descansar y hacer cardio de baja intensidad, consumir menos calorías de las que quemas (déficit calórico).</div><div style=\"color: rgba(0, 0, 0, 0.701961);background-color: rgb(255, 255, 255);\">Si tu objetivo es agregarle kilos a tus músculos sin ganar tantos kilos de grasa (ten en cuenta que el exceso calórico, aumenta aún así sea en un pequeño porcentaje, la grasa) puedes implementar la dieta Bulk &amp; Cut, unos 4 meses aumentando músculo, y los 4 meses siguientes dedicándote a cortar la grasa. Importante también, es que las calorías que necesitas diariamente tienen que ser especificas para ti, esto en cuanto a tu peso, nivel de actividad física y demás.</div><div style=\"color: rgba(0, 0, 0, 0.701961);background-color: rgb(255, 255, 255);\"><br/></div><div style=\"color: rgba(0, 0, 0, 0.701961);background-color: rgb(255, 255, 255);\">Para informarte de los suplementos te puedes poner en contacto conmigo y estaré encantado de ayudarte. </div><div style=\"color: rgba(0, 0, 0, 0.701961);background-color: rgb(255, 255, 255);\"><br/></div><div style=\"color: rgba(0, 0, 0, 0.701961);background-color: rgb(255, 255, 255);\">Espero haber resuelto tus dudas, si necesitas saber mas puedes ponerte en contacto conmigo y te facilitare mucha más información.</div><div style=\"color: rgba(0, 0, 0, 0.701961);background-color: rgb(255, 255, 255);\"><br/></div><div style=\"color: rgba(0, 0, 0, 0.701961);background-color: rgb(255, 255, 255);\">¡Éxitos!</div>","2015-08-18 19:22:37","2015-08-18 19:22:37"
194,80,"<p>Y cuanto pesas actualmente. Lo importante con tu edad no es el tipo de ejercicio que hagas, sino que más importante es la alimentación que lleves. </p>","2015-08-14 12:48:00","2015-08-14 12:48:00"
206,81,"<p>Muy buenas!!</p><p>Un buen entrenamiento muy utilizado para perder grasa, tonificar, ganar fuerza (no volumen) son los entrenamientos HIIT.</p><p>Son entrenamientos de corta duración pero a una intensidad alta, a continuación te pondré un ejemplo de entrenamiento HIIT de todo el cuerpo donde también trabajaras la zona de la espalda y conseguir lo que necesitas!</p><p>Ejemplo HiiT:</p><p>- 3 series de 10 ejercicios.</p><p>- Cada ejercicio son 30 segundos de trabajo + 30 segundos de descanso.</p><p>- Después de cada serie realizaremos 5 min de descanso.</p><p>- Intensidad alta.</p><title></title><p class=\"p1\"><span class=\"s1\">1- Sentadillas </span></p><p class=\"p1\"><span class=\"s1\">2- Flexiones</span></p><p class=\"p1\"><span class=\"s1\">3- Sentadillas de sumo</span></p><p class=\"p1\"><span class=\"s1\">4- Fondos de triceps</span></p><p class=\"p1\"><span class=\"s1\">5- Skiping (rodillas arriba)</span></p><p class=\"p1\"><span class=\"s1\">6- Jumping jacks frontal</span></p><p class=\"p1\"><span class=\"s1\">7- Saltos de tijera en plataforma</span></p><p class=\"p1\"><span class=\"s1\">8- Abdominales inferiores con los pies haciendo tijeras arriba y abajo.</span></p><p class=\"p1\"><span class=\"s1\">9- Burpees</span></p><p class=\"p1\"><span class=\"s1\">10- Abdominales isométricos (plancha)</span></p><p class=\"p1\"><span class=\"s1\"><br/></span></p><p class=\"p1\"><span class=\"s1\"><br/></span></p><p class=\"p1\"><span class=\"s1\">Cualquier duda que tengas pregunta, espero que te haya sido de ayuda!</span></p><p class=\"p1\"><span class=\"s1\">Saludos!</span></p><p><br/></p>","2015-08-16 18:29:09","2015-08-16 18:29:09"
220,81,"<p>Tienes multitud de ejercicios que te ayudarán con tu espalda, todo depende de si pretendes hacerlos en casa, o en un gimnasio o centro deportivo , etc..</p><p>A modo orientativo te daré algunos ejercicios, para que los puedas hacer en casa sin ningún tipo de material adicional más que elementos del hogar, pero deberías trabajar todo el cuerpo y no sólo la espalda. Si necesitas ejercicios para el resto del cuerpo tan sólo pregunta nuevamente y te contestaremos, por ahora, me limito a tu cuestión, usa los nombres en inglés para buscar los ejercicios en youtube y observar la técnica correcta de ejecución:</p><p>- Flexiones hindú. (hindú push ups)</p><p>- Dominadas australianas (australian pull ups) , varía la separación de las manos: close australian pull ups, shoulder width australian pull ups, wide australian pull ups. Este ejercicio puedes hacerlo usando una mesa.</p><p>- Remo renegade (renegade row). </p><p>- Shoulder shrugs. Puedes realizarlo sosteniendo tu cuerpo con los brazos estirados entre dos sillas o mesas.</p><p>- Bent over row.</p><p>- Reverse Hiperextensions. Puedes realizarlo con una mesa.</p><p>- Back extensions.</p><p>- Lying superman.</p><p><br/></p><p>Con esos simples ejercicios ya tienes un arsenal para tu espalda, ánimo! y recuerda: hay que trabajar el cuerpo completo.</p><p>Saludos!</p>","2015-08-19 10:46:39","2015-08-19 10:46:39"
215,83,"<p>Hola!</p><p>Para comenzar a realizar un trabajo con cargas externas siempre es recomendable empezar por máquinas, ya que son ejercicios guiados sencillos de realizar.</p><p>Después de un mes aproximadamente, en el que tu cuerpo ya se habrá adaptado al trabajo de fuerza, el peso libre (mancuernas, barras, autocargas, etc.)  es más recomendable, ya que además de la fuerza implica un trabajo mayor de coordinación y estabilidad que ayudará a que el estímulo del trabajo sea mayor.</p><p>Como consejos generales para comenzar un plan de entrenamiento de fuerza:</p><p>- Trabaja grupos musculares grandes, ejercicios poliarticulares (Remo, Press banca, dominadas, Prensa, a ser posible en máquina). Evitar ejercicios muy específicos como el curl de bíceps, ya que interesa trabajar al principio de la forma más global posible.</p><p>- Combina el entrenamiento de fuerza con el de resistencia en los primeros meses. 4 sesiones a la semana, en las que trabajes 2 de resistencia y 2 de fuerza, es una buena forma de comenzar tu entrenamiento. La natación puede ser una buena opción, siempre que se realicen series de mínimo 200 metros para que la frecuencia cardíaca este por encima del umbral aeróbico durante un tiempo aceptable, al menos 5 minutos.</p><p>- Realizar entre 8-10 ejercicios por sesión, trabajando cada uno 2 series de 15-20 repeticiones. Ejercicios de tren inferior y superior, para un trabajo global de todo el cuerpo, e incluir el trabajo del CORE (abdominales, lumbares, oblicuos, transverso).</p><p>Después de este primer mes, lo ideal sería cambiar la rutina de entrenamiento, evaluar resultados, y pasar a ejercicios algo más complejos a la vez que subamos la intensidad del entrenamiento. </p><p>Espero haberte sido de ayuda, para cualquier duda puedes consultarme.</p><p>Un saludo y ánimo con tu nuevo reto!</p>","2015-08-19 08:30:58","2015-08-19 08:30:58"
